;meta[language=en]
; id      |key(hex)|key(str)| text
;
; rename this file to mod<YOUR MODNAME>.speech.csv and
; add all strings for custom voicelines like the example line below.
;
; make sure the XXXX is the string id-space of the project and nnn is unique
; for every line.
;
;211XXXXnnn|example voiceline text
;
2114670650|00000000||I need some fresh air.
2114670651|00000000||A letter?
2114670652|00000000||Regis… Just trying to avoid a fight, to protect her.
2114670653|00000000||Well, I should check the orphanage.
2114670654|00000000||Go home. I'm a witcher. Need to examine the body.
2114670662|00000000||I've heard the guards are looking for Orianna.
2114670663|00000000||I wish they'd caught this monster, or whatever she really is.
2114670655|00000000||Woman turned back here.
2114670656|00000000||Think she was looking for Regis. But he left.
2114670657|00000000||Fishermen should know something.
2114670658|00000000||Tracks lead to this house.
2114670659|00000000||House looks inhabited… No sign of the dweller, though. Guess I'll look around.
2114670660|00000000||Interesting… Regis might be right.
2114670661|00000000||Need to hide, see how things play out…
;
2114670700|00000000||Triss?! I should talk to her.
2114670705|00000000||I've been thinking about us.
2114670706|00000000||I'm looking for…
2114670707|00000000||I'm not Yennefer, Geralt. But I can be like Yennefer!
2114670708|00000000||So, what do you think?
2114670709|00000000||You don't like me..
2114670710|00000000||You realize - one word and you'll howl with pain!
2114670711|00000000||I'm your nightmare!
;
; scene 9 - nightmare final
;
2114670720|00000000||[Kill]
2114670721|00000000||[Spare]
2114670722|00000000||Is it your doing?
2114670723|00000000||Fuck you!
2114670724|00000000||Help me, and I'll return the favor.
2114670725|00000000||Yes.
2114670726|00000000||No.
2114670727|00000000||Geralt, please…
;2114670728|00000000||Show me your face. - 1097827|00000000||And who might you be?
2114670729|00000000||I must be out of my mind…
2114670730|00000000||I warned you. Pissing upwind leads to disaster.
2114670731|00000000||This time you pissed in a tornado.
2114670732|00000000||Do anything stupid and they'll tie you down on an anthill, face coated with honey. You'll scream so loud even the storm riders will hear you.
2114670733|00000000||Are you ghosts?
2114670734|00000000||I'm sorry, my friend…
2114670735|00000000||You wish to give your soul for this?
2114670736|00000000||Then you don't have what I need.
2114670737|00000000||Is it your doing?
2114670738|00000000||So you say, yet I wait and wait, and nothing…
2114670739|00000000||Fuck you!
2114670740|00000000||Death mistake.
;2114670745|00000000||Crazy nightmare. - what a dream instead
;
; scene 11 orphanage main
;
2114670755|00000000||A witcher
2114670756|00000000||Just a traveler
2114670757|00000000||Vampire of Rivia
2114670758|00000000||It's a deal
2114670759|00000000||Why are you interested in the children?
; 0000382555|00000000||What did you need the children for?
;2114670760|00000000||I'll ask again, polite like, and you'll answer, just as politely.
2114670761|00000000||Orianna will kill you
2114670762|00000000||Who the foek are you?!
2114670763|00000000||Me? Drifter, stranger, mutant… Sometimes even by my name. Vampire of Rivia.
2114670764|00000000||Very funny, you cretin…
;    393630|00000000||Just a traveler. Happened to be passing through.
2114670765|00000000||Just a traveler you say… And that's just two swords on your back? Looks like you can swing them as well.
;   1094310|00000000||Geralt of Rivia. Witcher.
2114670766|00000000||A witcher? So you know how to track down somebody, right?
2114670767|00000000||Well, come in then, we've matters to discuss.
;2114670768|00000000||I am supposed to find a red-haired woman here.
2114670784|00000000||I'm looking for a red-haired woman.
;;; neuro-voiced I am supposed to find a red-haired woman here.
2114670769|00000000||That's interesting. Because we're supposed to meet her too.
2114670770|00000000||Why are you looking for her?
2114670771|00000000||Our boss has questions for 'er about the orphanage and children.
2114670772|00000000||The orphanage was attacked and almost none of the children survived.
2114670773|00000000||Almost - nice word, so someone is alive. And we know for sure that Orianna herself is alive too.
2114670774|00000000||But she doesn't want to come here. So there's something wrong with here. We are few, and we guard the places where she used to be.
2114670783|00000000||Perhaps you could help us, and then our leader Baron Edward will give you a decent reward.
2114670775|00000000||For what reason are you interested in the children?
; 0000382555|00000000||What did you need the children for?
2114670776|00000000||It's no concern of yours.
2114670777|00000000||Orianna will kill you. She is a monster, not a human. And only I can help. Meaning I need more information.
2114670778|00000000||I've not got all the answers, talk with our leader about it.
;   1117735|00000000||I'll ask again, polite like, and you'll answer, just as politely.
2114670779|00000000||Would ya look at that lads, vagrant mutt's givin' us orders. Needs to know 'is place… Fuck 'im up!
;2114670780|00000000||Three against one - you're dead already.
2114670781|00000000||It's a deal. Where can I find him?
2114670782|00000000||We have pitched camp on the banks of the lake known as Seidhe Llygad, near an ancient amphitheater.
;   1003998|00000000||See what I can do.
;
; scene 12 orphanage loose
;
2114670790|00000000||Hahaha, shove off, vargant!
2114670791|00000000||If you decide to help - our camp is on the banks of the lake known as Seidhe Llygad, near an ancient amphitheater.
;   1000528|00000000||Dammit…
;
; scene 13 orphanage gp
;
2114670795|00000000||Interesting. Son of a bandit in the vampire's claws…
2114670796|00000000||What's with the mutterin'? Go and talk with the Baron.
;
; scene 14 orphanage win
;
;   1195382|00000000||Argh!
2114670800|00000000||Gonna answer me?
2114670801|00000000||Baron won't be happy… Alright, I'll tell you what I know.
2114670802|00000000||Years ago our leader, Baron Edward, visited Toussaint, where he met a beautiful lass.
2114670803|00000000||And a wee boy was born to them.
2114670804|00000000||The Baron went with us to the far lands, where we were culled by battalions of Nilfs.
2114670805|00000000||Well, I can't say that the Baron liked that girl much, as he left her here. However he recently said we must visit Toussaint again.
2114670806|00000000||We came here and found out that she had died of some illness about a year ago. And the boy was sent to an orphanage, to this Orianna.
2114670807|00000000||But we didn't manage to find neither the boy nor Orianna.
2114670808|00000000||Since that vampire attack the orphanage has been abandoned… All that remains now is a mess and a pile children's corpses.
2114670809|00000000||The Baron was quite upset. But then we learned that Orianna is alive and in perfect health - people saw her in the city with the wee boy.
2114670810|00000000||The Baron is certain that this is his son, and very much wants to find this woman. However she is… elusive, everyone knows her, but where she is - no one seems to know.
2114670811|00000000||So we divided into groups and now watching for places where she may appear.
2114670812|00000000||To be honest, I'm well tired of sittin' around here waitin'… So if you could find a way to help us, it'd be well appreciated!
2114670813|00000000||I see it now. It's a deal.
2114670814|00000000||Then you should talk to the Baron.
;    499337|00000000||Where can I find him?
;2114670815|00000000||We have pitched camp on the banks of the lake known as Seidhe Llygad, near an ancient amphitheater.
;   1003998|00000000||See what I can do.
;
; scene 16 - baron meeting
;
2114670869|00000000||Picked a bad place to hide.
2114670870|00000000||Let's talk about my fee.
2114670871|00000000||I'll do it for free.
2114670872|00000000||I don't work for bandits.
2114670873|00000000||The child?
;;2114670873|00000000||Why do you wanna take the child?
2114670874|00000000||I agree.
2114670875|00000000||I don't agree.
;    393630|00000000||Just a traveler. Happened to be passing through.
2114670877|00000000||Piss off, vagrant. There's nothing for you here.
2114670878|00000000||Halt! What are you looking for?
2114670879|00000000||I'm a witcher. Your friends sent me here. Gotta deal with the Baron.
;;;2114670879|00000000||I'm a witcher. Your friends asked me to find you.
;;; or neuro-voiced I'm a witcher. Your friends sent me here. Gotta deal with the Baron.
2114670880|00000000||Well, alright. The Baron is in Beauclair at the moment, should be back soon. Wait here a bit.
2114670881|00000000||Greetings, Baron! Any news? Where is Alfred?
2114670882|00000000||He is gone. Orianna killed him.
2114670883|00000000||What?! But… How? Tell me what happened.
2114670970|00000000||Oh, shit…
2114670884|00000000||She is not just a woman. Maybe a witch or a monster… I'm not entirely sure what happened myself.
2114670885|00000000||And who is th… A witcher? It must be destiny that sent you to us.
2114670886|00000000||Actually, it was your friends. I'm Geralt.
;;; neuro-voice Actually, it was your friends. My name is Geralt.
2114670887|00000000||He's the famous Geralt of Rivia, no less.
2114670888|00000000||My name is Edward, and I take care of these fine gentlemen…
;   1075517|00000000||Bandits?
2114670889|00000000||Don't be so prejudiced, Geralt, we don't rob and kill the innocent..
2114670890|00000000||I don't believe it. However I'm here about Orianna.
2114670891|00000000||Of course. This evil woman, she refuses to return something precious to me.
2114670892|00000000||That's why I'd like to contract your services, witcher. To kill that monster, and take back that which belongs to me.
2114670893|00000000||The child.
2114670894|00000000||Huh, I should've known you'd already figured it out. I'd expect nothing less from a witcher…
2114670406|00000000||Have my men already told you about the boy?
;
;;;2114670725|00000000||Yes.
2114670407|00000000||Naturally. Well, we can skip the story then. Will you take the job?
;
;;;2114670726|00000000||No.
2114670408|00000000||That's hard to believe, considering all the strange stories they've rumored about me.
;
2114670409|00000000||It's no matter, I'll tell you the truth of it.
2114670410|00000000||Have you ever truly loved somebody, witcher?
;
;;;000110575|00000000||Yes, I've loved. (option)
;;;0001105772|00000000||Yeah. I've loved. Can we get to the matter at hand?
;;;0001105756|00000000||You don't give a shit. (option)
;;;0000594745|00000000||Doesn't matter. And don't change the subject.
;;;0001105762|00000000||No, I've never loved. (option)
;;;0001105762|00000000||No. Haven't loved. Now let's get to the point.
;
2114670400|00000000||I loved a woman once….
2114670401|00000000||I was born a commoner, but I was gifted with a blade.
2114670411|00000000||After proving myself in battle, the Duke of Toussaint knighted me as a young man.
2114670412|00000000||It was quite a spectacle, all the nobles wanted to meet the low-born Knight.
2114670413|00000000||That's how I met her, the only one who didn't care about all that.
2114670414|00000000||We fell in love… We had a son together, and we were happy, for a time.
2114670415|00000000||When word broke that she bore a child to a commoner, outside of wedlock…
2114670416|00000000||I fled Beauclair that very night, and I made her promise to say the child was against her will.
2114670417|00000000||She broke our promise. Her family quickly fell out of favor. They lost everything because of me.
2114670418|00000000||A few months ago, I received word that she had fallen ill, and our child had been orphaned…
2114670419|00000000||I never should have left her alone in that city.
2114670420|00000000||After all of these years of regret… I need to do right by her and take care of our son.
2114670421|00000000||What do you say witcher? Will you take the job, and return my boy?
;
2114670895|00000000||I don't work for bandits.
2114670896|00000000||We're not common bandits, but that's beside the point.
2114670897|00000000||I'm asking for your help as a father… And I can reward you handsomely.
;
;   1209328|00000000||Need to talk about my fee, first.
2114670898|00000000||I couldn't pay so much even if  you were King Radovid!
2114670899|00000000||That's a bit high, witcher.
2114670900|00000000||Thank you, witcher. I will repay you.
2114670901|00000000||My patience has ended! You will take my offer - 3000 orens, or get out of here!
2114670902|00000000||Have you changed your mind, witcher?
;   1007115|00000000||All right.
;   1030870|00000000||Hmm… Need to think about it.
2114670904|00000000||You fight for a noble cause. But if you return my boy… I will find a way to repay you.
2114670905|00000000||But I need more information. Your friend… What happened to him?
2114670906|00000000||We set up an ambush, outside Orianna's estate.
2114670907|00000000||Alfred and I had her cornered, with nowhere to go. I asked her what she'd done with my son.
2114670903|00000000||She gave a contemptible answer, so Alfred motioned for his blade.
2114670908|00000000||All at once she vanished. And Alfred… I was covered in his blood. There was nothing I could do!
2114670909|00000000||What kind of creature could do such a thing?
2114670910|00000000||Uh, must be a kind of vampire.
2114670911|00000000||A vampire? Geralt, my son is in danger. You're my only hope!
2114670912|00000000||All right, see if I can find her.
2114670913|00000000||You're not wrong. We've heard some strange sounds… In that direction, by the amphitheater.
2114670914|00000000||I told my men to stay away from it. It'd be nice, if you could have a look.
;
;
; scene 17 - baron oneliners
;
2114670625|00000000||Remember, Geralt, the boy mustn't be harmed.
2114670626|00000000||Have you found Orianna?
;   1035069|00000000||Not yet.
2114670627|00000000||Then get to work! My son is in danger!
2114670628|00000000||Come on!
2114670629|00000000||Where are you going, coward?
2114670630|00000000||That the best you've got?
2114670631|00000000||I see why you let her go.
;
; scene 18
;
2114670915|00000000||I will pay
2114670916|00000000||You will help me for free
2114670917|00000000||I want to help that woman
;   1124989|00000000||Good day. Fish biting?
2114670918|00000000||I catch more when it's raining.
2114670919|00000000||Did you see a red-haired woman here? Left this site by boat, recently.
2114670920|00000000||Maybe. Maybe not. Give me a few coins and I'll try to remember.
;    400593|00000000||I want to help that woman. She could be in danger.
2114670921|00000000||I would believe you if you had a satchel of herbs instead of those blades sheathed on your back.
;   1125802|00000000||Asking a lot. Too much. How about you do this free of charge, huh? Out of the kindness of your heart?
2114670922|00000000||Aye, I'll help. Outta kindness…
;    434805|00000000||Fine… I'll pay.
2114670923|00000000||Oh, I'm lucky to stumble across wealth today.
2114670924|00000000||Well… you listen up.
2114670925|00000000||The woman came from that direction by the cemetery.
2114670926|00000000||Paid me a tidy sum to take her across the river.
2114670927|00000000||She was nervous and dirty, but I didn't ask her about it.
2114670928|00000000||I dropped her off near the Cockatrice Inn.
2114670929|00000000||She hopped off the boat without saying a word…
;   1029815|00000000||Hm, interesting. Thanks.
2114670932|00000000||Good luck to you!
;
; scene 19 - orianna appear
;
2114670939|00000000||Sweet thing.
2114670935|00000000||Here we are.
; Sweet thing for horse
2114670936|00000000||Children!
2114670937|00000000||Come on!
2114670938|00000000||Children, it seems there's a matter I must attend to. Go on, Niellan, you and Agneta get dinner started. I'll be home soon enough.
;
; scene 20 - orianna main
;
2114670458|00000000||Wolves asleepin' 'midst the trees, bats all aswayin' in the breeze…
2114670459|00000000||But one soul lies anxious, wide awake, fearin' all manner of ghouls, hags and wraiths…
2114670940|00000000||Let us end this.
2114670941|00000000||We need to talk first.
2114670942|00000000||[Show letter from Regis.]
2114670943|00000000||Talked enough, let's fight.
;
;   1174593|00000000||Wolves_asleepin'_'midst_the_trees__bats_all_aswayi
;   1176970|00000000||But_one_soul_lies_anxious__wide_awake__fearin'_all
;    366968|00000000||Nice_tune__Damn_sad__though_
2114670944|00000000||Folk have forgotten it.
2114670945|00000000||Got… other things on their mind.
2114670946|00000000||Things like me?
2114670947|00000000||It's time.
2114670948|00000000||Well, no witcher's ever died in his own bed.
2114670949|00000000||You won't be an exception.
;
;   1172302|00000000||We don't have to fight.
2114670968|00000000||You've killed a man who wanted to reunite a boy with his father.
2114670950|00000000||Well, the threat of a sword doesn't always bring out the best in me.
2114670951|00000000||Fair enough. But the children… You can't continue to use them as livestock.
2114670952|00000000||And who exactly are you to lecture me?
2114670953|00000000||I know this might sound strange but I want to help you. I've come across something interesting in your house…
2114670954|00000000||So, you've been snooping around… Do I intrigue you that much, witcher?
2114670955|00000000||Orianna, your orphanage was destroyed. You've tried to rebuild it, but you're about to lose it all again.
;2114670451|00000000||I think somewhere deep inside, you don't want to be the same monster anymore.
2114670451|00000000||I get the feeling you no longer consider these repetitive circumstances as minor inconveniences.
2114670956|00000000||So you've read a few meaningless musings and now you presume to understand me?
2114670957|00000000||I may not understand you, but I do know one thing. You don't have to drink blood.
2114670958|00000000||Haha, such nonsense, witcher. Need I remind you of what I am? Drinking blood is essential to my survival.
2114670969|00000000||You can't help me. No one can help me.
2114670976|00000000||Know what? You're right.
2114670450|00000000||Don't feel like talking to you anymore.
2114670452|00000000||Goodbye, witcher…
;
;   1007115|00000000||All right.
2114670979|00000000||I may not be able to, but a mutual friend may be able to.
2114670959|00000000||Look at this.
2114670960|00000000||Hmm. Regis, Regis… Awfully considerate as always.
2114670977|00000000||"The act of drinking blood for sustenance is a mere myth", interesting… He seems certain…
2114670967|00000000||Well, I suppose he'd be upset if we tussled, wouldn't he?
2114670971|00000000||Even if you kill me… Villagers, knights and other witchers will always come after you, and you know it.
2114670978|00000000||You've no idea what it's like to constantly fight to overcome your hunger, your nature. However..
2114670972|00000000||Give me a moment.
2114670453|00000000||One who comes from Gharasham must be strong in spirit, merciful and noble. Really, Regis? When we first met you took so much pride in attacking these feeble humans from above.
2114670454|00000000||And now it seems things have changed… apparently. Perhaps after all these centuries… it is finally time.
2114670455|00000000||All right, Regis.
2114670961|00000000||I've made my decision.
2114670457|00000000||I vow never to feed on blood again.
;;; (-) 2114670962|00000000||But Niellan and Agneta will stay with me. I'm used to take care of them and… It will distract me from obsessive thoughts about hunger.
2114670963|00000000||Can I trust you to keep your vow?
2114670964|00000000||Unlike your kind, witcher, we tend to keep our promises.
;   1027471|00000000||Hmm… Guess I believe you…
2114670973|00000000||Alright. But you must leave Toussaint immediately. The guards are looking for you.
2114670974|00000000||I suppose it was inevitable.. I shall leave this place.
2114670965|00000000||Where will you go?
2114670456|00000000||The letter you gave me wasn't only meant for you, Geralt.
2114670975|00000000||I see. Well, good luck then.
2114670966|00000000||I shall take my valuables and say goodbye to the children. Wait for me here, White Wolf.
;
; scene 21 orianna to bruxa
;
2114670301|00000000||In times past. No amount of coin would convince a witcher to take this contract.
2114670300|00000000||Times have changed.
;
; scene 24
;
2114670315|00000000||The children are in that house.
2114670316|00000000||I'll take care of him myself.
2114670317|00000000||Your son is dead.
2114670318|00000000||I don't know.
;2114670319|00000000||coins (TEST)
;2114670320|00000000||sword (TEST)
2114670321|00000000||Hey, witcher!
2114670322|00000000||You're still breathin'?
2114670323|00000000||I'm glad to hear it… She got what she deserved.
2114670324|00000000||Now tell me, where's my boy?
2114670325|00000000||I don't know where he is.
2114670326|00000000||You take me for a fool? You think my men didn't see your conversation with her!?
2114670327|00000000||I'll give you one more chance.
;   1068309|00000000||Your son is dead.
;;;2114670328|00000000||Where is his body?
2114670329|00000000||Hmmm…er…well…
;;;2114670330|00000000||You seek to trick me, witcher.
;;;2114670331|00000000||Perhaps I have to loosen your tongue with a knife.
2114670332|00000000||I'll take care of him myself.
2114670333|00000000||Is that supposed to be a joke?
2114670334|00000000||You're common bandits. I don't trust you.
2114670335|00000000||You'll regret that you got in my way!
2114670336|00000000||The children are in that house. A young girl with a boy. Alive.
;   1091952|00000000||You'll look after her?
2114670337|00000000||All right, I will.
2114670338|00000000||Sure hope so. Here's my advice, don't show it to them.
2114670339|00000000||I wish Neillan could have known his real mother… It seems this is where our paths diverge, Geralt.
2114670340|00000000||There's your payment… As I promised.
;   1019171|00000000||Farewell.
2114670341|00000000||I know you're not interested in my coin… but I have something else in mind.
;   1130945|00000000||What a surprise.
2114670342|00000000||It was given to me by Margot… Neillan's mother. It's powerful, but cursed with sadness.
;    451753|00000000||Thank you. Farewell.
;    490004|00000000||That a threat?
2114670343|00000000||I challenge you to a duel! You and I!
2114670344|00000000||Goodbye, witcher. And… Thank you.
2114670345|00000000||Take care of it, in her name.
2114670346|00000000||How long has he been here? (ask Jato where's voiceline)
2114670347|00000000||About an hour. Saw… (ask Jato where's voiceline)
2114670348|00000000||Thank the heavens! My boy is okay…
2114670349|00000000||There was no need to be so difficult Geralt. Anyways…
2114670350|00000000||What about the girl? You'll look after her?
;
; scene 25
;
2114670355|00000000||No…
;    373208|00000000||Had enough?
2114670356|00000000||Good choice.
2114670358|00000000||I'm gonna fucking kill you, witcher!
;;;2114670422|00000000||Cough,Cough,Cough,Cough,Aaa… Aaaaaah… No!
2114670422|00000000||*Cough* Aaaaaah… No!
2114670423|00000000||This is my sin, and it dies here with me!
2114670424|00000000||*Cough* Tyberious, take the men, and get out of this wretched land.
2114670425|00000000||Go! 'Fore I kill you myself!
2114670426|00000000||And you… You will take this blade… and keep it safe for my son.
2114670427|00000000||The blade… Margot… You will tell him… It's name is Margot…
2114670428|00000000||Margot… I'm so sorry… I failed you…
;
; scene 26
;
;   1101069|00000000||Greetings.
2114670360|00000000||What happened witcher? Are ye' a coward? Why'd you let her go?!
;   1174787|00000000||Despite what you might've heard, I don't lunge at every monster I see, sword in hand. Talking gets the job done for some.
2114670361|00000000||Bullshit! I hired you to kill her!
;   1181655|00000000||Mhm. But I changed my mind.
2114670362|00000000||I don't have to explain myself to you.
2114670363|00000000||So you're a coward, and a traitor!
2114670364|00000000||Do you know what happens to those who betray me?
;    490004|00000000||That a threat?
2114670365|00000000||Kill him!
2114670429|00000000||You, piece of shit, I'll kill you!
2114670430|00000000||I'm gonna behead you, witcher!
;
; scene 27
;
; scene 28
;
;   1143303|00000000||What's the matter?
2114670375|00000000||A witcher slaying a human to protect a monster. I'll admit, I'm impressed.
;    458827|00000000||It was the lesser evil… I think.
;    0001153564|Had no choice.
2114670376|00000000||Am I correct in assuming that this most troublesome Baron Edward promised a most sizable reward?
2114670377|00000000||Here.
;   1066805|00000000||Mhm. Thanks a bunch.
2114670378|00000000||Good luck, Geralt of Rivia.
2114670379|00000000||Farewell, Orianna.
;
; scene 29
;
;
; scene 30
;
2114670390|00000000||Take care of 'em, Barnabas-Basil.
2114670391|00000000||Oh, with great pleasure, sir.
;; vanilla 2114670392|00000000||Follow me, please.
;
; scene 31
;
;
; scene 32 - removed
;
2114670402|00000000||Leave me be.
2114670403|00000000||I am all ears.
2114670404|00000000||Missed me that much?
2114670405|00000000||I thank you again, witcher. For your understanding and assistance.
;
; scene 33
;
2114670440|00000000||Mmmmh… Agneta?
2114670441|00000000||What have I done…
2114670442|00000000||The girl has a rapid heart rate and it seems that she has lost a significant amount of blood.
2114670443|00000000||You say she fell and hurt herself?
2114670444|00000000||Something like that. Tell me, will she be alright?
2114670445|00000000||I'm afraid such injuries have consequences. She may have a chance at recovery.
2114670446|00000000||She must drink plenty of fluids and remain in bed.
2114670447|00000000||Thank you, doctor.
